{
  "schema": "gunnchos.middleware.ring_input.v1",
  "event_id": "ring-evt-0001",
  "target_app": "libreoffice",
  "gesture": "text_inject",
  "confidence": 0.91,
  "payload": { "text": "RING_MEMO" },
  "ts_utc": "2026-08-16T16:30:00Z",
  "SILICON_EXACT_EMULATION": false,
  "PHYSICAL_RING_E6": false,
  "claim_boundary": "Digital Ring event envelope for contract tests. PHYSICAL_RING_E6=false."
}
